<?xml version="1.0"?>
<!DOCTYPE Report
[
<!ELEMENT Report (General ,(Doc|BPT)) >
<!ATTLIST Report ver CDATA #REQUIRED tmZone CDATA #REQUIRED>

<!ELEMENT General ( DocLocation ) >
<!ATTLIST General productName CDATA #REQUIRED productVer CDATA #REQUIRED os CDATA #REQUIRED host CDATA #REQUIRED qcserver CDATA #IMPLIED qcproject CDATA #IMPLIED SolManSolutionId CDATA #IMPLIED SolManProjectId CDATA #IMPLIED SolManTestPlanId CDATA #IMPLIED SolManTestPackageId CDATA #IMPLIED SolManUserInfoData CDATA #IMPLIED  >

<!ELEMENT BPT (DName,Res,DVer?,TSet?,TInst?,NodeArgs,AdditionalInfo*,Doc*) >
<!ATTLIST BPT rID ID #REQUIRED >

<!ELEMENT Doc (DName,ConfName?,Res,DVer?,TSet?,TInst?,RunType?,DT?,AdditionalInfo*,Step*,DIter*,Step*,Action*,Doc*,Summary?,TestMaintenanceSummary*,NodeArgs?) >
<!ATTLIST Doc rID ID #REQUIRED type (Test|BC|BPTWrapperTest|Flow|Group|Action) "Test" productName CDATA #REQUIRED BCIter CDATA #IMPLIED >

<!ELEMENT RunType ( #PCDATA )>
<!ATTLIST RunType fmStep (False|True) "False" batch (False|True) "False" upDesc (False|True) "False" upChk (False|True) "False" upAS (False|True) "False">

<!ELEMENT DName ( #PCDATA ) >

<!ELEMENT ConfName ( #PCDATA ) >

<!ELEMENT Res ( #PCDATA ) >

<!ELEMENT AdditionalInfo (AdditionalDataName,AdditionalDataValue ) >

<!ELEMENT AdditionalDataName ( #PCDATA ) >

<!ELEMENT AdditionalDataValue ( #PCDATA ) >

<!ELEMENT DVer ( #PCDATA ) >

<!ELEMENT TSet ( #PCDATA ) >

<!ELEMENT TInst ( #PCDATA ) >

<!ELEMENT DIter (Step*,Action+,Summary?,NodeArgs)>
<!ATTLIST DIter rID ID #REQUIRED iterID CDATA #REQUIRED>

<!ELEMENT DocLocation ( #PCDATA )>

<!ELEMENT Action (AName,AIter*,(Step|HtmlStep|Action)*, Summary,ActionMaintenanceSummary*, NodeArgs ) >
<!ATTLIST Action rID ID #REQUIRED>

<!ELEMENT AIter ((Step|HtmlStep|Action)*,DataMapping?, Summary?,NodeArgs) >
<!ATTLIST AIter rID ID #REQUIRED iterID CDATA #REQUIRED isCountable (False|True) "False" >

<!ELEMENT AName ( #PCDATA ) >

<!ELEMENT TestMaintenanceSummary (ActionMaintenanceSummary*) >
<!ATTLIST TestMaintenanceSummary ObjectsAdded CDATA #REQUIRED ObjectsUpdated CDATA #REQUIRED StepsUpdated CDATA #REQUIRED StepsComments CDATA #REQUIRED><!ELEMENT ActionMaintenanceSummary (ObjectChange* ) >
<!ATTLIST ActionMaintenanceSummary Action CDATA #REQUIRED Objects CDATA #REQUIRED Updated CDATA #REQUIRED LinesTotal CDATA #REQUIRED Added CDATA #REQUIRED LinesUpdated CDATA #REQUIRED>

<!ELEMENT ObjectChange  (Hierarchy, PropertyChangeList* ) >
<!ATTLIST ObjectChange Operation CDATA #IMPLIED OriginalRepository CDATA #IMPLIED>

<!ELEMENT PropertyChangeList (PropertyDef*) >

<!ELEMENT PropertyDef (OriginalValue, NewValue) >
<!ATTLIST PropertyDef PropName CDATA #REQUIRED OriginRegularExpression (True|False) "False" NewRegularExpression (True|False) "False" AddedProperty (True|False) "False" >

<!ELEMENT OriginalValue ( #PCDATA )>

<!ELEMENT NewValue ( #PCDATA )>

<!ELEMENT Hierarchy  (ObjectName, Hierarchy*) >
<!ATTLIST Hierarchy MicClass CDATA #REQUIRED>

<!ELEMENT ObjectName  ( #PCDATA ) >

<!ELEMENT Step (Obj,Details,Time,TimeTick* ,(Step|HtmlStep|Doc)*, DataMapping?, NodeArgs) >
<!ATTLIST Step rID ID #REQUIRED retval CDATA #IMPLIED>

<!ELEMENT HtmlStep (HTML,TimeTick*,(Step|HtmlStep|Doc)*,NodeArgs) >
<!ATTLIST HtmlStep rID ID #REQUIRED >

<!ELEMENT Obj ( #PCDATA ) >
<!ATTLIST Obj plainTxt (False|True) "True">

<!ELEMENT Details ( #PCDATA ) >
<!ATTLIST Details plainTxt (False|True) "True">

<!ELEMENT Time ( #PCDATA ) >

<!ELEMENT HTML ( #PCDATA ) >

<!ELEMENT Disp ( #PCDATA ) >

<!ELEMENT TimeTick ( #PCDATA ) >

<!ELEMENT DataMapping ( DataMappedItem* )>
<!ELEMENT DataMappedItem EMPTY >
<!ATTLIST DataMappedItem dsName CDATA #REQUIRED >
<!ATTLIST DataMappedItem rowId CDATA #REQUIRED >

<!ELEMENT NodeArgs (Disp,TopPane?,BtmPane?,ExtendedInfo? )>
<!ATTLIST NodeArgs eType CDATA #REQUIRED icon CDATA #REQUIRED nRep CDATA #REQUIRED UserNote CDATA #IMPLIED filter (False|True) "True">
<!ATTLIST NodeArgs status (Passed|Failed|Done|Warning|Information) "Done">
<!ATTLIST NodeArgs iconSel CDATA #IMPLIED nType CDATA #IMPLIED MovieMarker CDATA "">
<!ATTLIST NodeArgs Source CDATA #IMPLIED SourceLine CDATA #IMPLIED StepFlowItemKey CDATA #IMPLIED >

<!ELEMENT TopPane (Path)>

<!ELEMENT BtmPane ( (Path|WR)?,ASHilite?)>
<!ATTLIST BtmPane vType CDATA "HTML">

<!ELEMENT Path ( #PCDATA ) >

<!ELEMENT ASHilite ( #PCDATA ) >

<!ELEMENT WR ( #PCDATA ) >

<!ELEMENT ExtendedInfo ( StepData ) >

<!ATTLIST ExtendedInfo StepType CDATA #REQUIRED>
<!ELEMENT DT (NodeArgs) >
<!ATTLIST DT rID ID #REQUIRED>

<!ELEMENT Summary (Param*)>
<!ATTLIST Summary sTime CDATA #IMPLIED eTime CDATA #IMPLIED passed CDATA #IMPLIED failed CDATA #IMPLIED warnings CDATA #IMPLIED retval CDATA #IMPLIED stopped (False|True) "False" >

<!ELEMENT Param (ParamName,ParamVal)+ >
<!ATTLIST Param paramInOut (In|Out) "In">

<!ELEMENT ParamName ( #PCDATA ) >

<!ELEMENT ParamVal ( #PCDATA ) >

]
>
<Report ver="2.0" tmZone="W. Europe Standard Time">
<General productName="HP Unified Functional Testing" productVer="12.02" os="Windows 7" host="ITINBAC-DW0406"><DocLocation><![CDATA[\\ptpseelm-nt1045.ikeadt.com\TAC2\Wave 3 Automation\CustomerGoLive\RegressionPack0.9-CTE-f\Driver]]></DocLocation></General>
<Doc rID="T1"   productName= "HP Unified Functional Testing"  >
<DName><![CDATA[Driver]]></DName>
<Res><![CDATA[Res51]]></Res>
<DT rID="T2">
<NodeArgs eType="Table" icon="2" nRep="4" filter="False" >
<Disp><![CDATA[Run-Time Data Table]]></Disp>
<BtmPane vType="Table" >
<Path><![CDATA[Default_0.xls]]></Path>
</BtmPane>
</NodeArgs>
</DT>
<Step rID="T3">
<Obj ><![CDATA[Excel Sheet Import]]></Obj>
<Details ><![CDATA[Excel Sheet  Applications Import to Applications operation Done Succefully]]></Details>
<Time><![CDATA[8/18/2016 - 14:44:56]]></Time>
<TimeTick>1471524296</TimeTick>
<NodeArgs eType="User" icon="3" nRep="6" status="Passed" >
<Disp><![CDATA[Excel Sheet Import]]></Disp>
</NodeArgs>
</Step>
<Action rID="T4">
<AName><![CDATA[Driver]]></AName>
<Step rID="T5">
<Obj plainTxt="False" ><![CDATA[[ Browser ].Exist]]></Obj>
<Details plainTxt="False" ><![CDATA["Object does not exist"]]></Details>
<Time><![CDATA[8/18/2016 - 14:44:57]]></Time>
<TimeTick>1471524297</TimeTick>
<NodeArgs eType="Replay" icon="5" nRep="9" >
<Disp><![CDATA[[ Browser ].Exist]]></Disp>
</NodeArgs>
</Step>
<Step rID="T6">
<Obj ><![CDATA[Excel Sheet Import]]></Obj>
<Details ><![CDATA[Excel Sheet  Global Import to Global operation Done Succefully]]></Details>
<Time><![CDATA[8/18/2016 - 14:44:58]]></Time>
<TimeTick>1471524298</TimeTick>
<NodeArgs eType="User" icon="3" nRep="10" status="Passed" >
<Disp><![CDATA[Excel Sheet Import]]></Disp>
</NodeArgs>
</Step>
<Step rID="T7">
<Obj plainTxt="False" ><![CDATA[NWPFE]]></Obj>
<Details plainTxt="False" ><![CDATA[Browser]]></Details>
<Time><![CDATA[8/18/2016 - 14:45:01]]></Time>
<TimeTick>1471524301</TimeTick>
<Step rID="T8">
<Obj plainTxt="False" ><![CDATA[NWPFE]]></Obj>
<Details plainTxt="False" ><![CDATA[Page]]></Details>
<Time><![CDATA[8/18/2016 - 14:45:01]]></Time>
<TimeTick>1471524301</TimeTick>
<Step rID="T9">
<Obj plainTxt="False" ><![CDATA[NWPFE.Exist]]></Obj>
<Details plainTxt="False" ><![CDATA["Object does not exist"]]></Details>
<Time><![CDATA[8/18/2016 - 14:45:01]]></Time>
<TimeTick>1471524301</TimeTick>
<NodeArgs eType="Replay" icon="6" nRep="19" >
<Disp><![CDATA[NWPFE.Exist]]></Disp>
</NodeArgs>
</Step>
<Step rID="T10">
<Obj plainTxt="False" ><![CDATA[SystemUtil]]></Obj>
<Details plainTxt="False" ><![CDATA[SystemUtil]]></Details>
<Time><![CDATA[8/18/2016 - 14:45:01]]></Time>
<TimeTick>1471524301</TimeTick>
<Step rID="T11">
<Obj plainTxt="False" ><![CDATA[Run "iexplore.exe",1]]></Obj>
<Details plainTxt="False" ><![CDATA[Run "iexplore.exe",1]]></Details>
<Time><![CDATA[8/18/2016 - 14:45:01]]></Time>
<TimeTick>1471524301</TimeTick>
<NodeArgs eType="Replay" icon="7" nRep="23" status="Passed" >
<Disp><![CDATA[Run "iexplore.exe",1]]></Disp>
</NodeArgs>
</Step>
<NodeArgs eType="Replay" icon="7" nRep="22" status="Passed" >
<Disp><![CDATA[SystemUtil]]></Disp>
</NodeArgs>
</Step>
<NodeArgs eType="Context" icon="6" nRep="18" status="Passed" >
<Disp><![CDATA[NWPFE]]></Disp>
</NodeArgs>
</Step>
<Step rID="T12">
<Obj plainTxt="False" ><![CDATA[NWPFE.Exist]]></Obj>
<Details plainTxt="False" ><![CDATA["Object exists"]]></Details>
<Time><![CDATA[8/18/2016 - 14:45:26]]></Time>
<TimeTick>1471524326</TimeTick>
<NodeArgs eType="Replay" icon="5" nRep="24" >
<Disp><![CDATA[NWPFE.Exist]]></Disp>
</NodeArgs>
</Step>
<Step rID="T13">
<Obj plainTxt="False" ><![CDATA[NWPFE.Exist]]></Obj>
<Details plainTxt="False" ><![CDATA["Object exists"]]></Details>
<Time><![CDATA[8/18/2016 - 14:45:26]]></Time>
<TimeTick>1471524326</TimeTick>
<NodeArgs eType="Replay" icon="5" nRep="25" >
<Disp><![CDATA[NWPFE.Exist]]></Disp>
</NodeArgs>
</Step>
<NodeArgs eType="Context" icon="5" nRep="17" status="Passed" >
<Disp><![CDATA[NWPFE]]></Disp>
</NodeArgs>
</Step>
<Step rID="T14">
<Obj ><![CDATA[CheckBrowserExist]]></Obj>
<Details ><![CDATA[Browser exist]]></Details>
<Time><![CDATA[8/18/2016 - 14:45:26]]></Time>
<TimeTick>1471524326</TimeTick>
<NodeArgs eType="User" icon="3" nRep="26" >
<Disp><![CDATA[CheckBrowserExist]]></Disp>
</NodeArgs>
</Step>
<Step rID="T15">
<Obj plainTxt="False" ><![CDATA[NWPFE]]></Obj>
<Details plainTxt="False" ><![CDATA[Browser]]></Details>
<Time><![CDATA[8/18/2016 - 14:45:26]]></Time>
<TimeTick>1471524326</TimeTick>
<Step rID="T16">
<Obj plainTxt="False" ><![CDATA[NWPFE.Refresh All Tabs]]></Obj>
<Details plainTxt="False" ><![CDATA[]]></Details>
<Time><![CDATA[8/18/2016 - 14:45:26]]></Time>
<TimeTick>1471524326</TimeTick>
<NodeArgs eType="Replay" icon="5" nRep="29" >
<Disp><![CDATA[NWPFE.Refresh All Tabs]]></Disp>
</NodeArgs>
</Step>
<Step rID="T17">
<Obj plainTxt="False" ><![CDATA[NWPFE]]></Obj>
<Details plainTxt="False" ><![CDATA[Page]]></Details>
<Time><![CDATA[8/18/2016 - 14:45:30]]></Time>
<TimeTick>1471524330</TimeTick>
<Step rID="T18">
<Obj plainTxt="False" ><![CDATA[[ Link ].Exist]]></Obj>
<Details plainTxt="False" ><![CDATA["Object does not exist"]]></Details>
<Time><![CDATA[8/18/2016 - 14:45:30]]></Time>
<TimeTick>1471524330</TimeTick>
<NodeArgs eType="Replay" icon="8" nRep="35" >
<Disp><![CDATA[[ Link ].Exist]]></Disp>
</NodeArgs>
</Step>
<Step rID="T19">
<Obj plainTxt="False" ><![CDATA[[ Link ].Exist]]></Obj>
<Details plainTxt="False" ><![CDATA["Object does not exist"]]></Details>
<Time><![CDATA[8/18/2016 - 14:45:32]]></Time>
<TimeTick>1471524332</TimeTick>
<NodeArgs eType="Replay" icon="8" nRep="39" >
<Disp><![CDATA[[ Link ].Exist]]></Disp>
</NodeArgs>
</Step>
<NodeArgs eType="Context" icon="6" nRep="34" >
<Disp><![CDATA[NWPFE]]></Disp>
</NodeArgs>
</Step>
<NodeArgs eType="Context" icon="5" nRep="28" >
<Disp><![CDATA[NWPFE]]></Disp>
</NodeArgs>
</Step>
<Step rID="T20">
<Obj ><![CDATA[FE_Verify_Element_Exist]]></Obj>
<Details ><![CDATA[LOG IN element verified successfully.]]></Details>
<Time><![CDATA[8/18/2016 - 14:45:33]]></Time>
<TimeTick>1471524333</TimeTick>
<NodeArgs eType="User" icon="3" nRep="41" >
<Disp><![CDATA[FE_Verify_Element_Exist]]></Disp>
</NodeArgs>
</Step>
<Step rID="T21">
<Obj ><![CDATA[FE_Verify_Element_Exist]]></Obj>
<Details ><![CDATA[ All elements verified successfully.]]></Details>
<Time><![CDATA[8/18/2016 - 14:45:33]]></Time>
<TimeTick>1471524333</TimeTick>
<NodeArgs eType="User" icon="3" nRep="42" >
<Disp><![CDATA[FE_Verify_Element_Exist]]></Disp>
</NodeArgs>
</Step>
<Step rID="T22">
<Obj plainTxt="False" ><![CDATA[ICOW]]></Obj>
<Details plainTxt="False" ><![CDATA[Browser]]></Details>
<Time><![CDATA[8/18/2016 - 14:45:33]]></Time>
<TimeTick>1471524333</TimeTick>
<Step rID="T23">
<Obj plainTxt="False" ><![CDATA[ICOW]]></Obj>
<Details plainTxt="False" ><![CDATA[Page]]></Details>
<Time><![CDATA[8/18/2016 - 14:45:33]]></Time>
<TimeTick>1471524333</TimeTick>
<Step rID="T24">
<Obj plainTxt="False" ><![CDATA[txtICOWUsername.Exist]]></Obj>
<Details plainTxt="False" ><![CDATA["Object exists"]]></Details>
<Time><![CDATA[8/18/2016 - 14:45:33]]></Time>
<TimeTick>1471524333</TimeTick>
<NodeArgs eType="Replay" icon="9" nRep="46" >
<Disp><![CDATA[txtICOWUsername.Exist]]></Disp>
</NodeArgs>
</Step>
<NodeArgs eType="Context" icon="6" nRep="45" >
<Disp><![CDATA[ICOW]]></Disp>
</NodeArgs>
</Step>
<NodeArgs eType="Context" icon="5" nRep="44" >
<Disp><![CDATA[ICOW]]></Disp>
</NodeArgs>
</Step>
<Step rID="T25">
<Obj ><![CDATA[CheckObject]]></Obj>
<Details ><![CDATA[WebEdit  - ICOWUsernameExist]]></Details>
<Time><![CDATA[8/18/2016 - 14:45:33]]></Time>
<TimeTick>1471524333</TimeTick>
<NodeArgs eType="User" icon="3" nRep="47" >
<Disp><![CDATA[CheckObject]]></Disp>
</NodeArgs>
</Step>
<Step rID="T26">
<Obj plainTxt="False" ><![CDATA[ICOW]]></Obj>
<Details plainTxt="False" ><![CDATA[Browser]]></Details>
<Time><![CDATA[8/18/2016 - 14:45:33]]></Time>
<TimeTick>1471524333</TimeTick>
<Step rID="T27">
<Obj plainTxt="False" ><![CDATA[ICOW]]></Obj>
<Details plainTxt="False" ><![CDATA[Page]]></Details>
<Time><![CDATA[8/18/2016 - 14:45:33]]></Time>
<TimeTick>1471524333</TimeTick>
<Step rID="T28">
<Obj plainTxt="False" ><![CDATA[txtICOWUsername.Exist]]></Obj>
<Details plainTxt="False" ><![CDATA["Object exists"]]></Details>
<Time><![CDATA[8/18/2016 - 14:45:33]]></Time>
<TimeTick>1471524333</TimeTick>
<NodeArgs eType="Replay" icon="9" nRep="50" >
<Disp><![CDATA[txtICOWUsername.Exist]]></Disp>
</NodeArgs>
</Step>
<Step rID="T29">
<Obj plainTxt="False" ><![CDATA[txtICOWUsername.Click]]></Obj>
<Details plainTxt="False" ><![CDATA[]]></Details>
<Time><![CDATA[8/18/2016 - 14:45:33]]></Time>
<TimeTick>1471524333</TimeTick>
<NodeArgs eType="Replay" icon="9" nRep="52" >
<Disp><![CDATA[txtICOWUsername.Click]]></Disp>
</NodeArgs>
</Step>
<Step rID="T30">
<Obj plainTxt="False" ><![CDATA[txtICOWUsername.Set]]></Obj>
<Details plainTxt="False" ><![CDATA[""]]></Details>
<Time><![CDATA[8/18/2016 - 14:45:33]]></Time>
<TimeTick>1471524333</TimeTick>
<NodeArgs eType="Replay" icon="9" nRep="54" >
<Disp><![CDATA[txtICOWUsername.Set]]></Disp>
</NodeArgs>
</Step>
<NodeArgs eType="Context" icon="6" nRep="49" >
<Disp><![CDATA[ICOW]]></Disp>
</NodeArgs>
</Step>
<NodeArgs eType="Context" icon="5" nRep="48" >
<Disp><![CDATA[ICOW]]></Disp>
</NodeArgs>
</Step>
<Step rID="T31">
<Obj ><![CDATA[TakeAction]]></Obj>
<Details ><![CDATA[WebEdit  - ICOWUsername
Entered - ]]></Details>
<Time><![CDATA[8/18/2016 - 14:45:33]]></Time>
<TimeTick>1471524333</TimeTick>
<NodeArgs eType="User" icon="3" nRep="55" >
<Disp><![CDATA[TakeAction]]></Disp>
</NodeArgs>
</Step>
<Step rID="T32">
<Obj plainTxt="False" ><![CDATA[ICOW]]></Obj>
<Details plainTxt="False" ><![CDATA[Browser]]></Details>
<Time><![CDATA[8/18/2016 - 14:45:33]]></Time>
<TimeTick>1471524333</TimeTick>
<Step rID="T33">
<Obj plainTxt="False" ><![CDATA[ICOW]]></Obj>
<Details plainTxt="False" ><![CDATA[Page]]></Details>
<Time><![CDATA[8/18/2016 - 14:45:33]]></Time>
<TimeTick>1471524333</TimeTick>
<Step rID="T34">
<Obj plainTxt="False" ><![CDATA[txtICOWUsername.Exist]]></Obj>
<Details plainTxt="False" ><![CDATA["Object exists"]]></Details>
<Time><![CDATA[8/18/2016 - 14:45:33]]></Time>
<TimeTick>1471524333</TimeTick>
<NodeArgs eType="Replay" icon="9" nRep="58" >
<Disp><![CDATA[txtICOWUsername.Exist]]></Disp>
</NodeArgs>
</Step>
<Step rID="T35">
<Obj plainTxt="False" ><![CDATA[txtICOWUsername.Click]]></Obj>
<Details plainTxt="False" ><![CDATA[]]></Details>
<Time><![CDATA[8/18/2016 - 14:45:33]]></Time>
<TimeTick>1471524333</TimeTick>
<NodeArgs eType="Replay" icon="9" nRep="60" >
<Disp><![CDATA[txtICOWUsername.Click]]></Disp>
</NodeArgs>
</Step>
<Step rID="T36">
<Obj plainTxt="False" ><![CDATA[txtICOWUsername.Set]]></Obj>
<Details plainTxt="False" ><![CDATA["iwctestuser2"]]></Details>
<Time><![CDATA[8/18/2016 - 14:45:33]]></Time>
<TimeTick>1471524333</TimeTick>
<NodeArgs eType="Replay" icon="9" nRep="62" >
<Disp><![CDATA[txtICOWUsername.Set]]></Disp>
</NodeArgs>
</Step>
<NodeArgs eType="Context" icon="6" nRep="57" >
<Disp><![CDATA[ICOW]]></Disp>
</NodeArgs>
</Step>
<NodeArgs eType="Context" icon="5" nRep="56" >
<Disp><![CDATA[ICOW]]></Disp>
</NodeArgs>
</Step>
<Step rID="T37">
<Obj ><![CDATA[TakeAction]]></Obj>
<Details ><![CDATA[WebEdit  - ICOWUsername
Entered - iwctestuser2]]></Details>
<Time><![CDATA[8/18/2016 - 14:45:33]]></Time>
<TimeTick>1471524333</TimeTick>
<NodeArgs eType="User" icon="3" nRep="63" >
<Disp><![CDATA[TakeAction]]></Disp>
</NodeArgs>
</Step>
<Step rID="T38">
<Obj plainTxt="False" ><![CDATA[ICOW]]></Obj>
<Details plainTxt="False" ><![CDATA[Browser]]></Details>
<Time><![CDATA[8/18/2016 - 14:45:33]]></Time>
<TimeTick>1471524333</TimeTick>
<Step rID="T39">
<Obj plainTxt="False" ><![CDATA[ICOW]]></Obj>
<Details plainTxt="False" ><![CDATA[Page]]></Details>
<Time><![CDATA[8/18/2016 - 14:45:33]]></Time>
<TimeTick>1471524333</TimeTick>
<Step rID="T40">
<Obj plainTxt="False" ><![CDATA[txtICOWPwd.Exist]]></Obj>
<Details plainTxt="False" ><![CDATA["Object exists"]]></Details>
<Time><![CDATA[8/18/2016 - 14:45:33]]></Time>
<TimeTick>1471524333</TimeTick>
<NodeArgs eType="Replay" icon="9" nRep="66" >
<Disp><![CDATA[txtICOWPwd.Exist]]></Disp>
</NodeArgs>
</Step>
<NodeArgs eType="Context" icon="6" nRep="65" >
<Disp><![CDATA[ICOW]]></Disp>
</NodeArgs>
</Step>
<NodeArgs eType="Context" icon="5" nRep="64" >
<Disp><![CDATA[ICOW]]></Disp>
</NodeArgs>
</Step>
<Step rID="T41">
<Obj ><![CDATA[CheckObject]]></Obj>
<Details ><![CDATA[WebEdit  - ICOWPwdExist]]></Details>
<Time><![CDATA[8/18/2016 - 14:45:33]]></Time>
<TimeTick>1471524333</TimeTick>
<NodeArgs eType="User" icon="3" nRep="67" >
<Disp><![CDATA[CheckObject]]></Disp>
</NodeArgs>
</Step>
<Step rID="T42">
<Obj plainTxt="False" ><![CDATA[ICOW]]></Obj>
<Details plainTxt="False" ><![CDATA[Browser]]></Details>
<Time><![CDATA[8/18/2016 - 14:45:33]]></Time>
<TimeTick>1471524333</TimeTick>
<Step rID="T43">
<Obj plainTxt="False" ><![CDATA[ICOW]]></Obj>
<Details plainTxt="False" ><![CDATA[Page]]></Details>
<Time><![CDATA[8/18/2016 - 14:45:33]]></Time>
<TimeTick>1471524333</TimeTick>
<Step rID="T44">
<Obj plainTxt="False" ><![CDATA[txtICOWPwd.Exist]]></Obj>
<Details plainTxt="False" ><![CDATA["Object exists"]]></Details>
<Time><![CDATA[8/18/2016 - 14:45:33]]></Time>
<TimeTick>1471524333</TimeTick>
<NodeArgs eType="Replay" icon="9" nRep="70" >
<Disp><![CDATA[txtICOWPwd.Exist]]></Disp>
</NodeArgs>
</Step>
<Step rID="T45">
<Obj plainTxt="False" ><![CDATA[txtICOWPwd.Click]]></Obj>
<Details plainTxt="False" ><![CDATA[]]></Details>
<Time><![CDATA[8/18/2016 - 14:45:33]]></Time>
<TimeTick>1471524333</TimeTick>
<NodeArgs eType="Replay" icon="9" nRep="72" >
<Disp><![CDATA[txtICOWPwd.Click]]></Disp>
</NodeArgs>
</Step>
<Step rID="T46">
<Obj plainTxt="False" ><![CDATA[txtICOWPwd.Set]]></Obj>
<Details plainTxt="False" ><![CDATA[""]]></Details>
<Time><![CDATA[8/18/2016 - 14:45:33]]></Time>
<TimeTick>1471524333</TimeTick>
<NodeArgs eType="Replay" icon="9" nRep="74" >
<Disp><![CDATA[txtICOWPwd.Set]]></Disp>
</NodeArgs>
</Step>
<NodeArgs eType="Context" icon="6" nRep="69" >
<Disp><![CDATA[ICOW]]></Disp>
</NodeArgs>
</Step>
<NodeArgs eType="Context" icon="5" nRep="68" >
<Disp><![CDATA[ICOW]]></Disp>
</NodeArgs>
</Step>
<Step rID="T47">
<Obj ><![CDATA[TakeAction]]></Obj>
<Details ><![CDATA[WebEdit  - ICOWPwd
Entered - ]]></Details>
<Time><![CDATA[8/18/2016 - 14:45:33]]></Time>
<TimeTick>1471524333</TimeTick>
<NodeArgs eType="User" icon="3" nRep="75" >
<Disp><![CDATA[TakeAction]]></Disp>
</NodeArgs>
</Step>
<Step rID="T48">
<Obj plainTxt="False" ><![CDATA[ICOW]]></Obj>
<Details plainTxt="False" ><![CDATA[Browser]]></Details>
<Time><![CDATA[8/18/2016 - 14:45:33]]></Time>
<TimeTick>1471524333</TimeTick>
<Step rID="T49">
<Obj plainTxt="False" ><![CDATA[ICOW]]></Obj>
<Details plainTxt="False" ><![CDATA[Page]]></Details>
<Time><![CDATA[8/18/2016 - 14:45:33]]></Time>
<TimeTick>1471524333</TimeTick>
<Step rID="T50">
<Obj plainTxt="False" ><![CDATA[txtICOWPwd.Exist]]></Obj>
<Details plainTxt="False" ><![CDATA["Object exists"]]></Details>
<Time><![CDATA[8/18/2016 - 14:45:33]]></Time>
<TimeTick>1471524333</TimeTick>
<NodeArgs eType="Replay" icon="9" nRep="78" >
<Disp><![CDATA[txtICOWPwd.Exist]]></Disp>
</NodeArgs>
</Step>
<Step rID="T51">
<Obj plainTxt="False" ><![CDATA[txtICOWPwd.Click]]></Obj>
<Details plainTxt="False" ><![CDATA[]]></Details>
<Time><![CDATA[8/18/2016 - 14:45:34]]></Time>
<TimeTick>1471524334</TimeTick>
<NodeArgs eType="Replay" icon="9" nRep="80" >
<Disp><![CDATA[txtICOWPwd.Click]]></Disp>
</NodeArgs>
</Step>
<Step rID="T52">
<Obj plainTxt="False" ><![CDATA[txtICOWPwd.Set]]></Obj>
<Details plainTxt="False" ><![CDATA["loTtor85"]]></Details>
<Time><![CDATA[8/18/2016 - 14:45:34]]></Time>
<TimeTick>1471524334</TimeTick>
<NodeArgs eType="Replay" icon="9" nRep="82" >
<Disp><![CDATA[txtICOWPwd.Set]]></Disp>
</NodeArgs>
</Step>
<NodeArgs eType="Context" icon="6" nRep="77" >
<Disp><![CDATA[ICOW]]></Disp>
</NodeArgs>
</Step>
<NodeArgs eType="Context" icon="5" nRep="76" >
<Disp><![CDATA[ICOW]]></Disp>
</NodeArgs>
</Step>
<Step rID="T53">
<Obj ><![CDATA[TakeAction]]></Obj>
<Details ><![CDATA[WebEdit  - ICOWPwd
Entered - loTtor85]]></Details>
<Time><![CDATA[8/18/2016 - 14:45:34]]></Time>
<TimeTick>1471524334</TimeTick>
<NodeArgs eType="User" icon="3" nRep="83" >
<Disp><![CDATA[TakeAction]]></Disp>
</NodeArgs>
</Step>
<Step rID="T54">
<Obj plainTxt="False" ><![CDATA[ICOW]]></Obj>
<Details plainTxt="False" ><![CDATA[Browser]]></Details>
<Time><![CDATA[8/18/2016 - 14:45:34]]></Time>
<TimeTick>1471524334</TimeTick>
<Step rID="T55">
<Obj plainTxt="False" ><![CDATA[ICOW]]></Obj>
<Details plainTxt="False" ><![CDATA[Page]]></Details>
<Time><![CDATA[8/18/2016 - 14:45:34]]></Time>
<TimeTick>1471524334</TimeTick>
<Step rID="T56">
<Obj plainTxt="False" ><![CDATA[btnLogin.Exist]]></Obj>
<Details plainTxt="False" ><![CDATA["Object exists"]]></Details>
<Time><![CDATA[8/18/2016 - 14:45:34]]></Time>
<TimeTick>1471524334</TimeTick>
<NodeArgs eType="Replay" icon="10" nRep="86" >
<Disp><![CDATA[btnLogin.Exist]]></Disp>
</NodeArgs>
</Step>
<NodeArgs eType="Context" icon="6" nRep="85" >
<Disp><![CDATA[ICOW]]></Disp>
</NodeArgs>
</Step>
<NodeArgs eType="Context" icon="5" nRep="84" >
<Disp><![CDATA[ICOW]]></Disp>
</NodeArgs>
</Step>
<Step rID="T57">
<Obj ><![CDATA[CheckObject]]></Obj>
<Details ><![CDATA[WebButton  - LoginExist]]></Details>
<Time><![CDATA[8/18/2016 - 14:45:34]]></Time>
<TimeTick>1471524334</TimeTick>
<NodeArgs eType="User" icon="3" nRep="87" >
<Disp><![CDATA[CheckObject]]></Disp>
</NodeArgs>
</Step>
<Step rID="T58">
<Obj plainTxt="False" ><![CDATA[ICOW]]></Obj>
<Details plainTxt="False" ><![CDATA[Browser]]></Details>
<Time><![CDATA[8/18/2016 - 14:45:34]]></Time>
<TimeTick>1471524334</TimeTick>
<Step rID="T59">
<Obj plainTxt="False" ><![CDATA[ICOW]]></Obj>
<Details plainTxt="False" ><![CDATA[Page]]></Details>
<Time><![CDATA[8/18/2016 - 14:45:34]]></Time>
<TimeTick>1471524334</TimeTick>
<Step rID="T60">
<Obj plainTxt="False" ><![CDATA[btnLogin.Exist]]></Obj>
<Details plainTxt="False" ><![CDATA["Object exists"]]></Details>
<Time><![CDATA[8/18/2016 - 14:45:34]]></Time>
<TimeTick>1471524334</TimeTick>
<NodeArgs eType="Replay" icon="10" nRep="90" >
<Disp><![CDATA[btnLogin.Exist]]></Disp>
</NodeArgs>
</Step>
<Step rID="T61">
<Obj plainTxt="False" ><![CDATA[btnLogin.Click]]></Obj>
<Details plainTxt="False" ><![CDATA[]]></Details>
<Time><![CDATA[8/18/2016 - 14:45:34]]></Time>
<TimeTick>1471524334</TimeTick>
<NodeArgs eType="Replay" icon="10" nRep="92" >
<Disp><![CDATA[btnLogin.Click]]></Disp>
</NodeArgs>
</Step>
<NodeArgs eType="Context" icon="6" nRep="89" >
<Disp><![CDATA[ICOW]]></Disp>
</NodeArgs>
</Step>
<NodeArgs eType="Context" icon="5" nRep="88" >
<Disp><![CDATA[ICOW]]></Disp>
</NodeArgs>
</Step>
<Step rID="T62">
<Obj ><![CDATA[FE_Verify_Element_Exist]]></Obj>
<Details ><![CDATA[LOG OUT element verified successfully.]]></Details>
<Time><![CDATA[8/18/2016 - 14:45:35]]></Time>
<TimeTick>1471524335</TimeTick>
<NodeArgs eType="User" icon="3" nRep="94" >
<Disp><![CDATA[FE_Verify_Element_Exist]]></Disp>
</NodeArgs>
</Step>
<Step rID="T63">
<Obj ><![CDATA[FE_Verify_Element_Exist]]></Obj>
<Details ><![CDATA[ All elements verified successfully.]]></Details>
<Time><![CDATA[8/18/2016 - 14:45:35]]></Time>
<TimeTick>1471524335</TimeTick>
<NodeArgs eType="User" icon="3" nRep="95" >
<Disp><![CDATA[FE_Verify_Element_Exist]]></Disp>
</NodeArgs>
</Step>
<Step rID="T64">
<Obj ><![CDATA[FE_Login_ICOW]]></Obj>
<Details ><![CDATA[ Profile is Logged in successfully ]]></Details>
<Time><![CDATA[8/18/2016 - 14:45:35]]></Time>
<TimeTick>1471524335</TimeTick>
<NodeArgs eType="User" icon="3" nRep="96" >
<Disp><![CDATA[FE_Login_ICOW]]></Disp>
</NodeArgs>
</Step>
<Step rID="T65">
<Obj ><![CDATA[FE_Verify_Element_Exist]]></Obj>
<Details ><![CDATA[Search profiles element verified successfully.]]></Details>
<Time><![CDATA[8/18/2016 - 14:45:36]]></Time>
<TimeTick>1471524336</TimeTick>
<NodeArgs eType="User" icon="3" nRep="98" >
<Disp><![CDATA[FE_Verify_Element_Exist]]></Disp>
</NodeArgs>
</Step>
<Step rID="T66">
<Obj ><![CDATA[FE_Verify_Element_Exist]]></Obj>
<Details ><![CDATA[ All elements verified successfully.]]></Details>
<Time><![CDATA[8/18/2016 - 14:45:36]]></Time>
<TimeTick>1471524336</TimeTick>
<NodeArgs eType="User" icon="3" nRep="99" >
<Disp><![CDATA[FE_Verify_Element_Exist]]></Disp>
</NodeArgs>
</Step>
<Step rID="T67">
<Obj plainTxt="False" ><![CDATA[ICOW]]></Obj>
<Details plainTxt="False" ><![CDATA[Browser]]></Details>
<Time><![CDATA[8/18/2016 - 14:45:36]]></Time>
<TimeTick>1471524336</TimeTick>
<Step rID="T68">
<Obj plainTxt="False" ><![CDATA[ICOW]]></Obj>
<Details plainTxt="False" ><![CDATA[Page]]></Details>
<Time><![CDATA[8/18/2016 - 14:45:36]]></Time>
<TimeTick>1471524336</TimeTick>
<Step rID="T69">
<Obj plainTxt="False" ><![CDATA[txtemailSearch_ICOW.Set]]></Obj>
<Details plainTxt="False" ><![CDATA["rcpte2@gmail.com"]]></Details>
<Time><![CDATA[8/18/2016 - 14:45:36]]></Time>
<TimeTick>1471524336</TimeTick>
<NodeArgs eType="Replay" icon="9" nRep="104" >
<Disp><![CDATA[txtemailSearch_ICOW.Set]]></Disp>
</NodeArgs>
</Step>
<Step rID="T70">
<Obj plainTxt="False" ><![CDATA[btnSEARCH_ICOW.Exist]]></Obj>
<Details plainTxt="False" ><![CDATA["Object exists"]]></Details>
<Time><![CDATA[8/18/2016 - 14:45:36]]></Time>
<TimeTick>1471524336</TimeTick>
<NodeArgs eType="Replay" icon="10" nRep="105" >
<Disp><![CDATA[btnSEARCH_ICOW.Exist]]></Disp>
</NodeArgs>
</Step>
<NodeArgs eType="Context" icon="6" nRep="103" >
<Disp><![CDATA[ICOW]]></Disp>
</NodeArgs>
</Step>
<NodeArgs eType="Context" icon="5" nRep="102" >
<Disp><![CDATA[ICOW]]></Disp>
</NodeArgs>
</Step>
<Step rID="T71">
<Obj ><![CDATA[CheckObject]]></Obj>
<Details ><![CDATA[WebButton  - SEARCH_ICOWExist]]></Details>
<Time><![CDATA[8/18/2016 - 14:45:36]]></Time>
<TimeTick>1471524336</TimeTick>
<NodeArgs eType="User" icon="3" nRep="106" >
<Disp><![CDATA[CheckObject]]></Disp>
</NodeArgs>
</Step>
<Step rID="T72">
<Obj plainTxt="False" ><![CDATA[ICOW]]></Obj>
<Details plainTxt="False" ><![CDATA[Browser]]></Details>
<Time><![CDATA[8/18/2016 - 14:45:36]]></Time>
<TimeTick>1471524336</TimeTick>
<Step rID="T73">
<Obj plainTxt="False" ><![CDATA[ICOW]]></Obj>
<Details plainTxt="False" ><![CDATA[Page]]></Details>
<Time><![CDATA[8/18/2016 - 14:45:36]]></Time>
<TimeTick>1471524336</TimeTick>
<Step rID="T74">
<Obj plainTxt="False" ><![CDATA[btnSEARCH_ICOW.Exist]]></Obj>
<Details plainTxt="False" ><![CDATA["Object exists"]]></Details>
<Time><![CDATA[8/18/2016 - 14:45:36]]></Time>
<TimeTick>1471524336</TimeTick>
<NodeArgs eType="Replay" icon="10" nRep="109" >
<Disp><![CDATA[btnSEARCH_ICOW.Exist]]></Disp>
</NodeArgs>
</Step>
<Step rID="T75">
<Obj plainTxt="False" ><![CDATA[btnSEARCH_ICOW.Click]]></Obj>
<Details plainTxt="False" ><![CDATA[]]></Details>
<Time><![CDATA[8/18/2016 - 14:45:36]]></Time>
<TimeTick>1471524336</TimeTick>
<NodeArgs eType="Replay" icon="10" nRep="111" >
<Disp><![CDATA[btnSEARCH_ICOW.Click]]></Disp>
</NodeArgs>
</Step>
<Step rID="T76">
<Obj plainTxt="False" ><![CDATA[[ rcpte2@gmail.comVigneshAcceptREGULARNo ].Exist]]></Obj>
<Details plainTxt="False" ><![CDATA["Object exists"]]></Details>
<Time><![CDATA[8/18/2016 - 14:45:37]]></Time>
<TimeTick>1471524337</TimeTick>
<NodeArgs eType="Replay" icon="8" nRep="114" >
<Disp><![CDATA[[ rcpte2@gmail.comVigneshAcceptREGULARNo ].Exist]]></Disp>
</NodeArgs>
</Step>
<Step rID="T77">
<Obj plainTxt="False" ><![CDATA[[ rcpte2@gmail.comVigneshAcceptREGULARNo ].Click]]></Obj>
<Details plainTxt="False" ><![CDATA[]]></Details>
<Time><![CDATA[8/18/2016 - 14:45:38]]></Time>
<TimeTick>1471524338</TimeTick>
<NodeArgs eType="Replay" icon="8" nRep="117" >
<Disp><![CDATA[[ rcpte2@gmail.comVigneshAcceptREGULARNo ].Click]]></Disp>
</NodeArgs>
</Step>
<Step rID="T78">
<Obj plainTxt="False" ><![CDATA[lnkRemoveprofile.Exist]]></Obj>
<Details plainTxt="False" ><![CDATA["Object does not exist"]]></Details>
<Time><![CDATA[8/18/2016 - 14:45:38]]></Time>
<TimeTick>1471524338</TimeTick>
<NodeArgs eType="Replay" icon="8" nRep="120" >
<Disp><![CDATA[lnkRemoveprofile.Exist]]></Disp>
</NodeArgs>
</Step>
<NodeArgs eType="Context" icon="6" nRep="108" >
<Disp><![CDATA[ICOW]]></Disp>
</NodeArgs>
</Step>
<NodeArgs eType="Context" icon="5" nRep="107" >
<Disp><![CDATA[ICOW]]></Disp>
</NodeArgs>
</Step>
<Step rID="T79">
<Obj ><![CDATA[]]></Obj>
<Details ><![CDATA[Links are not clicked]]></Details>
<Time><![CDATA[8/18/2016 - 14:45:38]]></Time>
<TimeTick>1471524338</TimeTick>
<NodeArgs eType="User" icon="3" nRep="121" status="Warning" >
<Disp><![CDATA[]]></Disp>
</NodeArgs>
</Step>
<Step rID="T80">
<Obj ><![CDATA[ICOW_SearchingProfile]]></Obj>
<Details ><![CDATA[Result is not matching with Searching Profile]]></Details>
<Time><![CDATA[8/18/2016 - 14:45:38]]></Time>
<TimeTick>1471524338</TimeTick>
<NodeArgs eType="User" icon="3" nRep="122" status="Warning" >
<Disp><![CDATA[ICOW_SearchingProfile]]></Disp>
</NodeArgs>
</Step>
<Step rID="T81">
<Obj ><![CDATA[TS_Wave3_NWP_ST_FE_Positive_Reset_Password]]></Obj>
<Details ><![CDATA[Reset password Notification is not displayed]]></Details>